"Technology","Quadrant","Maturity","Description","Product URL","AI URL","moved / no change","project Count","Customer strategic"
"Prime Faces","Solution Technology","phase out",""," ","","n","1",""
"Swing","Solution Technology","phase out",""," ","","n","1",""
"Vaadin","Solution Technology","phase out","Vaadin is a Java framework for building modern web applications. https://vaadin.com/home"," ","","n","1",""
"VB.NET Winforms","Solution Technology","phase out","Windows GUI framework"," ","","n","0",""
"yFiles","Solution Technology","phase out","yFiles for Java is an extensive Java™ class librarythat provides algorithms and components enabling the analysis, visualization, and the automatic layout of graphs, diagrams, and networks. http://www.yworks.com/en/products_yfiles_about.html "," ","","n","1",""
"OpenNLP","Solution Technology","watch","The Apache OpenNLP library is a machine learning based toolkit for the processing of natural language text.","https://opennlp.apache.org/","http://connect/communities/sigs/naturallanguageprocessing/Pages/default.aspx","n","2",""
"Tableau","Solution Technology","watch","""Excel on steroids"" - BI / analysis platform"," ","","n","0",""
"YarcData","Solution Technology","watch","The YarcData Urika graph appliance is a purpose built solution for Big Data relationship analytics."," ","","n","0",""
"Apache Accumulo","Solution Technology","watch","Apache Accumulo is a computer software project that developed a sorted, distributed key/value store based on the BigTable technology from Google.[1] It is a system built on top of Apache Hadoop, Apache ZooKeeper, and Apache Thrift. Written in Java, Accumulo has cell-level access labels and server-side programming mechanisms."," ","","n","1","Y"
"h2","Solution Technology","watch","H2 is a relational database management system written in Java. It can be embedded in Java applications or run in the client-server mode.[1] The disk footprint (size of the jar file) is about 1.5 MB"," ","","n","1",""
"MongoDB","Solution Technology","watch","MongoDB (from ""humongous"") is a cross-platform document-oriented database. Classified as a NoSQL database, MongoDB eschews the traditional table-based relational database structure in favor of JSON-like documents with dynamic schemas (MongoDB calls the format BSON), making the integration of data in certain types of applications easier and faster. (sourced Wikipedia)"," ","http://connect/Communities/SIGs/Bytesize/Documents/Introduction%20to%20MongoDB_V1%200.pptx","n","5","Y"
"Neo4j","Solution Technology","watch","Native graph database (Property Graph model)"," ","","n","1",""
"PostGIS","Solution Technology","watch","PostGIS is a spatial database extender for PostgreSQL object-relational database. It adds support for geographic objects allowing location queries to be run in SQL "," ","","n","1",""
"Denodo","Solution Technology","watch","","http://www.denodo.com/en/index.php","","n","2",""
"Kapow","Solution Technology","watch","Data integration platform","http://www.kapowsoftware.com/","","n","0",""
"NodeJS","Solution Technology","watch","Serverside Javascript see http://www.toptal.com/nodejs/why-the-hell-would-i-use-node-js","http://nodejs.org/","","m","2",""
"Bootstrap","Solution Technology","watch","Bootstrap is a free collection of tools for creating websites and web applications. It contains HTML and CSS-based design templates for typography, forms, buttons, navigation and other interface components, as well as optional JavaScript extensions.  (sourced Wikipedia)"," ","","n","4",""
"Foundation","Solution Technology","watch",""," ","","n","0",""
